{
  "schema": 1,
  "name": "Oxygen Metallic",
  "author": "Dynamic Island",
  "description": "The original: graphite metal with a silver rim and a top highlight.",
  "style": {
    "preset": "oxygen",
    "material": "metal",
    "strong": false,
    "opacity": 82,
    "blur": true,
    "blurLevel": 0,
    "radius": 100,
    "fill": "solid",
    "background": "#1a1b1d",
    "gradientType": "linear",
    "gradientAngle": 135,
    "gradientStops": [
      "#1a1b1d",
      "#134a83"
    ],
    "control": "#0a84ff",
    "text": "",
    "border": true,
    "borderWidth": 1,
    "borderColor": "",
    "shadow": 2
  }
}
