{
  "schema": 1,
  "name": "Symbiot Black",
  "author": "Dynamic Island",
  "description": "A black-to-charcoal gradient with a muted slate accent, inspired by a dark Plasma desktop.",
  "style": {
    "preset": "symbiot",
    "material": "flat",
    "strong": false,
    "opacity": 100,
    "blur": false,
    "blurLevel": 0,
    "radius": 100,
    "background": "#0e1012",
    "control": "#4c566a",
    "text": "#fcfcfc",
    "border": true,
    "borderWidth": 1,
    "borderColor": "#4c566a",
    "shadow": 0,
    "fill": "gradient",
    "gradientType": "linear",
    "gradientAngle": 180,
    "gradientStops": [
      "#292c30",
      "#202326",
      "#0e1012"
    ]
  }
}
