{
  "schema": 1,
  "name": "Sunset",
  "author": "Dynamic Island",
  "description": "Orange through magenta to purple, from left to right.",
  "style": {
    "preset": "sunset",
    "material": "flat",
    "strong": false,
    "opacity": 90,
    "blur": true,
    "blurLevel": 1,
    "radius": 100,
    "fill": "gradient",
    "background": "#a52a4a",
    "gradientType": "linear",
    "gradientAngle": 90,
    "gradientStops": [
      "#c2410c",
      "#be185d",
      "#6b21a8"
    ],
    "control": "#fdba74",
    "text": "",
    "border": true,
    "borderWidth": 1,
    "borderColor": "",
    "shadow": 1
  }
}
